{
  "schema_version": 1,
  "id": "FAST_DELIVERY",
  "title": "Fast Delivery",
  "authority": "PROCESS_ONLY",
  "required_inputs": [
    "repository",
    "baseline_sha",
    "authorized_scope"
  ],
  "steps": [
    {
      "id": "BASELINE",
      "action": "Reuse pinned Factory/repository baseline when still valid; resolve exact source SHA and authorized scope, refresh only on an invalidation or explicit update.",
      "gate": "EVIDENCE_REQUIRED",
      "parallel_safe": false,
      "outputs": [
        "baseline"
      ]
    },
    {
      "id": "BRANCH",
      "action": "Create one bounded branch for the step.",
      "gate": "STOP_ON_FAILURE",
      "parallel_safe": false,
      "outputs": [
        "branch"
      ]
    },
    {
      "id": "PREFLIGHT",
      "action": "Run cheapest deterministic preflight covering touched sources BEFORE expensive CI. When instrumentation tests change, compile their test sources/APK first when feasible; check schema/migration/permission invariants as relevant. Fix known failures before retrying full CI.",
      "gate": "STOP_ON_BLOCKER",
      "parallel_safe": true,
      "outputs": [
        "preflight"
      ]
    },
    {
      "id": "IMPLEMENT",
      "action": "Implement only the authorized behavior via minimum necessary process; assess genuine parallel-first workstreams once when the scope permits.",
      "gate": "STOP_ON_BLOCKER",
      "parallel_safe": true,
      "outputs": [
        "change"
      ]
    },
    {
      "id": "HYGIENE",
      "action": "Perform bounded obsolete/dependency/asset sweep.",
      "gate": "STOP_ON_FAILURE",
      "parallel_safe": true,
      "outputs": [
        "clean_tree"
      ]
    },
    {
      "id": "FOCUSED_VALIDATION",
      "action": "Run focused checks for actual blast radius after bounded hygiene; these do not replace required exact-head repository gates or higher-risk QA.",
      "gate": "STOP_ON_FAILURE",
      "parallel_safe": true,
      "outputs": [
        "validation"
      ]
    },
    {
      "id": "OPEN_PR_EARLY",
      "action": "Open PR without importing unrelated maintenance findings.",
      "gate": "NONE",
      "parallel_safe": true,
      "outputs": [
        "pr"
      ]
    },
    {
      "id": "EXACT_HEAD",
      "action": "Require all mandatory gates GREEN on the exact integrated head; reuse result/artifact only with matching source SHA, build contract, toolchain, signing and artifact identity, or rerun.",
      "gate": "EXACT_HEAD_GREEN",
      "parallel_safe": true,
      "outputs": [
        "exact_head_evidence"
      ]
    },
    {
      "id": "MERGE",
      "action": "Merge only if mergeable and no blocking review/user gate remains.",
      "gate": "EXACT_HEAD_GREEN",
      "parallel_safe": false,
      "outputs": [
        "merge_sha"
      ]
    }
  ],
  "completion": [
    "requested behavior merged or BLOCKED",
    "no unrelated maintenance scope absorbed",
    "completion claims evidence-backed"
  ]
}
